{
  "schema_version": 1,
  "entry_id": "qwen38-27b-nvfp4-sglang-dflash2-k8-core-subset-thinkon-low-20260819",
  "recorded_utc": "2026-08-19T16:35:07.305372+00:00",
  "model": {
    "id": "qwen38-27b",
    "display_name": "Qwen3.8-27B NVFP4 (r0b0tlab 4-of-4) SGLang DFlash2 K8 think-on-low SM121"
  },
  "runtime": {
    "hardware": "1x NVIDIA GB10 (DGX Spark), SGLang dflash2-0.2.0, fp8 KV auto, mem 0.73, think-on-low",
    "base_url_omitted": true,
    "speculative": {
      "method": "dflash2",
      "K": 8,
      "draft_tokens": 8,
      "config": "block=8, think-on reasoning_effort=low"
    },
    "template_default": "thinking on (reasoning_effort=low; chat_template_kwargs thinking+enable_thinking=true)"
  },
  "harness": {
    "name": "r0b0bench",
    "version": "1.0.0rc2",
    "profile": "core-subset"
  },
  "scores": {
    "canary": {
      "status": "PASS",
      "passed": true,
      "n": 5
    },
    "bfcl_mt": {
      "status": "PASS",
      "accuracy": 0.715,
      "correct": 143,
      "total": 200
    },
    "bfcl_ast": {
      "status": "PASS",
      "micro_accuracy": 0.305,
      "categories": {
        "multiple": {
          "accuracy": 0.19,
          "correct_count": 38,
          "raw": {
            "accuracy": 0.19,
            "correct_count": 38,
            "total_count": 200
          },
          "total_count": 200
        },
        "parallel": {
          "accuracy": 0.535,
          "correct_count": 107,
          "raw": {
            "accuracy": 0.535,
            "correct_count": 107,
            "total_count": 200
          },
          "total_count": 200
        },
        "parallel_multiple": {
          "accuracy": 0.19,
          "correct_count": 38,
          "raw": {
            "accuracy": 0.19,
            "correct_count": 38,
            "total_count": 200
          },
          "total_count": 200
        }
      }
    },
    "latency": {
      "status": "PASS",
      "ttft_ms_mean": 216.44660324818688,
      "itl_ms_mean": null,
      "e2el_ms_mean": 4291.360846757016
    },
    "concurrency": {
      "status": "PASS",
      "ladder_aggregate_tok_s": {
        "1": 61.063426579200716,
        "2": 113.85249978404912,
        "4": 187.48066294823764,
        "6": 252.58836783201104
      }
    },
    "throughput": {
      "status": "PASS",
      "decode_median_client_tok_s": 30.453265818618373,
      "prefill_median_prompt_tok_s": 26320.079571533694,
      "prefill_median_prompt_tok_s_proxy": 26320.079571533694,
      "prefill_mean_prompt_tok_s": 26320.079571533694,
      "prefill_median_prompt_tokens": 22802.0
    },
    "qa": {
      "status": "PASS",
      "accuracy": 0.96,
      "correct": 384,
      "n": 400
    },
    "ifeval": {
      "status": "PASS",
      "accuracy": 0.845,
      "correct": 169,
      "n": 200,
      "method": "ifeval_lightweight_constraint_scorer"
    },
    "humaneval": {
      "status": "PASS",
      "pass@1": 0.975609756097561,
      "n": 164
    },
    "gsm8k": {
      "status": "PASS",
      "accuracy": 0.97,
      "correct": 194,
      "n": 200,
      "method": "gsm8k_0shot_flexible_extract"
    },
    "niah": {
      "status": "PASS",
      "depths": [
        65280,
        130560,
        235008
      ],
      "max_model_len": 262144
    }
  },
  "infra_errors_total": 0,
  "invalid_for_publish": false,
  "disclosures": [
    "think-on reasoning_effort=low; quality budgets 4096 + NIAH reserve 1024 (recorded campaign diff, reverted); IFEval lightweight; NIAH depths 65280/130560/235008; latency 128-out all length (A/B budget); 10 IFEval empty on letter-constraint prompts (model); HE 1 empty HumanEval/145; GSM8K 200/200 stop max 2833<4096"
  ],
  "artifact_roots_private": [
    "evidence/qwen38-dflash2-r0b0bench-thinkon-low-20260819T130534Z"
  ]
}
