{
  "schema_version": 1,
  "entry_id": "nemotron-lightning-mtp-k1-thinking-on-core-subset-20260810",
  "recorded_utc": "2026-08-11T13:40:07.428155+00:00",
  "model": {
    "id": "nvidia/nemotron-3.5-lightning-30b-a3b",
    "display_name": "NVIDIA Nemotron 3.5 Lightning 30B-A3B NVFP4 (MTP K=1, GB10 SM121)"
  },
  "runtime": {
    "hardware": "NVIDIA GB10 (SM121), ARM64",
    "base_url_omitted": true,
    "image_id": "sha256:442df05bcaaf4ca33d1e7eb6d18ea0f4272be6b1503b6604dc191acbd4e47640",
    "image_tag": "nemotron-lightning-vllm:private-sm121-mtp",
    "vllm": "0.23.1rc1.dev1327+gf25953cc5",
    "moe_backend": "marlin",
    "kv_cache_dtype": "fp8",
    "speculative": {
      "method": "mtp",
      "K": 1,
      "backend": "triton"
    },
    "native_thinking": "thinking=true, enable_thinking=true (server template controls)",
    "profiles": {
      "systems_quality": "max_model_len=50016 max_num_seqs=6 batched=8192 util=0.70 prefix-caching on"
    }
  },
  "harness": {
    "name": "r0b0bench",
    "version": "1.0.0rc2",
    "profile": "core-subset"
  },
  "scores": {
    "canary": {
      "status": "PASS",
      "passed": true,
      "n": 5
    },
    "bfcl_mt": {
      "status": "PASS",
      "accuracy": 0.665,
      "correct": 133,
      "total": 200
    },
    "bfcl_ast": {
      "status": "PASS",
      "micro_accuracy": 0.2916666666666667,
      "categories": {
        "multiple": {
          "accuracy": 0.19,
          "correct_count": 38,
          "raw": {
            "accuracy": 0.19,
            "correct_count": 38,
            "total_count": 200
          },
          "total_count": 200
        },
        "parallel": {
          "accuracy": 0.495,
          "correct_count": 99,
          "raw": {
            "accuracy": 0.495,
            "correct_count": 99,
            "total_count": 200
          },
          "total_count": 200
        },
        "parallel_multiple": {
          "accuracy": 0.19,
          "correct_count": 38,
          "raw": {
            "accuracy": 0.19,
            "correct_count": 38,
            "total_count": 200
          },
          "total_count": 200
        }
      }
    },
    "latency": {
      "status": "PASS",
      "ttft_ms_mean": 93.62814300038735,
      "itl_ms_mean": 19.28555048526875,
      "e2el_ms_mean": 10085.781061252419
    },
    "concurrency": {
      "status": "PASS",
      "ladder_aggregate_tok_s": {
        "1": 99.47010110123497,
        "2": 151.6469698457452,
        "4": 217.0458356879143,
        "6": 252.00408605883925
      }
    },
    "throughput": {
      "status": "PASS",
      "decode_median_client_tok_s": 89.28874937113687,
      "prefill_median_prompt_tok_s": 2031.666099536002,
      "prefill_median_prompt_tok_s_proxy": 2031.666099536002,
      "prefill_mean_prompt_tok_s": 2031.666099536002,
      "prefill_median_prompt_tokens": 24541.0
    },
    "qa": {
      "status": "PASS",
      "accuracy": 0.9575,
      "correct": 383,
      "n": 400
    },
    "ifeval": {
      "status": "PASS",
      "accuracy": 0.775,
      "correct": 155,
      "n": 200,
      "method": "ifeval_lightweight_constraint_scorer"
    },
    "humaneval": {
      "status": "PASS",
      "pass@1": 0.9390243902439024,
      "n": 164
    },
    "gsm8k": {
      "status": "PASS",
      "accuracy": 0.91,
      "correct": 182,
      "n": 200,
      "method": "gsm8k_0shot_flexible_extract"
    },
    "niah": {
      "status": "PASS",
      "depths": [
        10456,
        20912,
        37641
      ],
      "max_model_len": 50016
    }
  },
  "infra_errors_total": 0,
  "invalid_for_publish": false,
  "disclosures": [
    "Full native-thinking core-subset run (thinking=true, enable_thinking=true): all 11 lanes PASS in one process, invalid_for_publish=false, zero infra errors. GSM8K 182/200 = 91.0% with 5/200 finish_reason=length rows at the 8,192 ceiling (scoreable model nontermination, disclosed in lane rows); campaign-accepted GSM8K is the 49,152-token retest 189/200 = 94.5% (separate reconciled row, invalid_for_publish=true, in the repro repo). Repro: https://github.com/r0b0tlab/nemotron-3.5-lightning-sm121-nvfp4"
  ],
  "artifact_roots_private": []
}