{
 "schema_version": 1,
 "entry_id": "qwen36-27b-nvfp4-validator-sglang-mtp-eagle-k4-systems-20260820",
 "recorded_utc": "2026-08-20T01:05:12.023134+00:00",
 "model": {
  "id": "qwen36-27b-nvfp4-validator",
  "display_name": "Qwen3.6-27B-NVFP4 MTP-EAGLE K=4 (Ornith-1.5 validator)"
 },
 "runtime": {
  "hardware": "GB10/SM121 (DGX Spark)",
  "base_url_omitted": true
 },
 "harness": {
  "name": "r0b0bench",
  "version": "1.0.0rc2",
  "profile": "core-subset"
 },
 "scores": {
  "canary": {
   "status": "PASS",
   "passed": true,
   "n": 5
  },
  "bfcl_mt": {
   "status": null,
   "accuracy": null,
   "correct": null,
   "total": 200
  },
  "bfcl_ast": {
   "status": null,
   "micro_accuracy": null,
   "categories": null
  },
  "latency": {
   "status": "PASS",
   "ttft_ms_mean": 163.17642673675437,
   "itl_ms_mean": 108.66444883140502,
   "e2el_ms_mean": 3858.1136749853613
  },
  "concurrency": {
   "status": "PASS",
   "ladder_aggregate_tok_s": {
    "1": 36.532787060023445,
    "2": 68.68737872352112,
    "4": 123.28907365392456,
    "6": 167.84547909470518
   }
  },
  "throughput": {
   "status": "PASS",
   "decode_median_client_tok_s": 23.729804385863588,
   "prefill_median_prompt_tok_s": 3100.587962452527,
   "prefill_median_prompt_tok_s_proxy": 3100.587962452527,
   "prefill_mean_prompt_tok_s": 3100.587962452527,
   "prefill_median_prompt_tokens": 22774.0
  },
  "qa": {
   "status": null,
   "accuracy": null,
   "correct": null,
   "n": null
  },
  "ifeval": {
   "status": null,
   "accuracy": null,
   "correct": null,
   "n": null,
   "method": null
  },
  "humaneval": {
   "status": null,
   "pass@1": null,
   "n": 164
  },
  "gsm8k": {
   "status": null,
   "accuracy": null,
   "correct": null,
   "n": null,
   "method": null
  },
  "niah": {
   "status": "PASS",
   "depths": [
    65472,
    130944,
    235699
   ],
   "max_model_len": 262144
  }
 },
 "infra_errors_total": 0,
 "invalid_for_publish": true,
 "disclosures": [
  "Numbers validate the serving package (r0b0tlab/ornith-15-397b-nvfp4-sglang) on the 27B validator checkpoint \u2014 they are NOT 397B Ornith throughput/quality measurements.",
  "MTP-EAGLE systems-only row (--only; separate from base-AR merged row): spec 3/1/4 checkpoint-MTP draft, accept_length 2.55, accept_rate 0.517, K=4 proven (spec_num_draft_tokens=4.0). Decode c1 23.81 tok/s (1.91x base), c6 agg 167.72 tok/s (2.6x), NIAH 3/3 PASS (262K window), prefill 3198 tok/s, TTFT 174ms. Thinking-off (reasoning_tokens=0 all lanes) => conservative regime; think-on acceptance expected higher (CoT=self-continuation)."
 ],
 "artifact_roots_private": []
}